{
  "id": "source:gallieni-1920",
  "kind": "book",
  "tier": "memoir",
  "author": "Gallieni, Joseph",
  "title": "Mémoires du général Gallieni: Défense de Paris, 25 août – 11 septembre 1914",
  "year": 1920,
  "publisher": "Payot, Paris",
  "url": "https://archive.org/details/mmoiresdfens00galluoft",
  "notes": "Gallieni's own account (he died in 1916; published by his family), with a documents annex printing the Paris orders of 3–9 September (Ordre général no 5 of 4 September, the proclamation of 3 September). Written to assert Gallieni's priority over Joffre in the Marne decision; cite the documents, treat the narrative as one side of that dispute. Also the account of the Paris camp and the 6th Army's attack on the Ourcq, including the requisition of the Paris taxis on 6–7 September 1914. Read at page resolution for three things: the proclamation of 3 September, reproduced in facsimile on the unnumbered plate at p. 65, with the posting of it in the first hour of that morning at p. 63; the requisition of the taxis on 7 September and the move of Trentinian's 7th Division from Gagny and Noisy-le-Sec to Nanteuil-le-Haudouin in the course of the night (pp. 162, 167) — he gives no number of cabs; and the drive to Melun on 4 September (pp. 119–123)."
}
