{
  "id": "source:dick-1981",
  "kind": "book",
  "tier": "study",
  "author": "Dick, Auguste",
  "title": "Emmy Noether 1882–1935",
  "year": 1981,
  "publisher": "Birkhäuser, Boston",
  "isbn": "978-3-7643-3019-4",
  "notes": "The standard short biography (translated from the 1970 German). Cite for the Göttingen years: the refused habilitation, the courses announced under Hilbert's name, the habilitation of 1919 and the unsalaried years to 1923."
}
