{
  "id": "source:doughty-2005",
  "kind": "book",
  "tier": "study",
  "author": "Doughty, Robert A.",
  "title": "Pyrrhic Victory: French Strategy and Operations in the Great War",
  "year": 2005,
  "publisher": "Belknap Press of Harvard University Press, Cambridge MA",
  "notes": "The standard operational history of the French army in the war, written from the AFGG and the GQG archives; the spine for Plan XVII, the Ardennes offensive and Joffre's handling of his army commanders."
}
