{
  "id": "source:pais-1982",
  "kind": "book",
  "tier": "study",
  "author": "Pais, Abraham",
  "title": "'Subtle is the Lord…': The Science and the Life of Albert Einstein",
  "year": 1982,
  "publisher": "Oxford University Press, Oxford",
  "notes": "The standard scientific biography; relativity 1907–1919, the Entwurf theory, the 1914 eclipse expedition, the counter-manifesto."
}
