{
  "id": "source:bohr-1913",
  "kind": "article",
  "tier": "primary",
  "author": "Bohr, Niels",
  "title": "On the Constitution of Atoms and Molecules, Parts I–III",
  "year": 1913,
  "publisher": "Philosophical Magazine, ser. 6, vol. 26: pp. 1–25 (no. 151, July), 476–502 (no. 153, September), 857–875 (no. 155, November)",
  "notes": "The quantum atom as Bohr first stated it. Cite for the model, the stationary states and the hydrogen spectrum; the three parts are one argument and are cited here as one work."
}
