{
  "id": "source:mollo-1977",
  "kind": "book",
  "tier": "general",
  "author": "Mollo, Andrew",
  "title": "Army Uniforms of World War I: European and United States Armies and Aviation Services",
  "year": 1977,
  "publisher": "Blandford Press, Poole",
  "notes": "The standard one-volume comparison of what the armies of 1914–18 wore, army by army — German field-grey and the covered Pickelhaube, British khaki service dress, the Belgian greatcoat and shako and the 1915 change to khaki. Use it for cut, colour and the dates of pattern changes across several armies at once, which is exactly what a comparison card needs. Same caution as Sumner: the plates are drawn reconstructions and the book is a uniformology reference, not an operational history."
}
