{
  "id": "source:rutherford-1919",
  "kind": "article",
  "tier": "primary",
  "author": "Rutherford, Ernest",
  "title": "Collision of α Particles with Light Atoms, Parts I–IV",
  "year": 1919,
  "publisher": "Philosophical Magazine, ser. 6, vol. 37, no. 222, pp. 537–587; Part IV, 'An anomalous effect in nitrogen', pp. 581–587",
  "notes": "The four papers reporting the first artificial disintegration of a nucleus. Cite for what Rutherford observed and concluded in 1919 — not for the reaction as now written, which is Blackett (1925)."
}
