{
  "id": "source:heilbron-1974",
  "kind": "book",
  "tier": "study",
  "author": "Heilbron, J. L.",
  "title": "H. G. J. Moseley: The Life and Letters of an English Physicist, 1887–1915",
  "year": 1974,
  "publisher": "University of California Press, Berkeley",
  "notes": "Moseley's law, his enlistment in 1914 and death at Gallipoli."
}
