{
  "id": "source:agawa-1979",
  "kind": "book",
  "tier": "study",
  "author": "Agawa, Hiroyuki",
  "title": "The Reluctant Admiral: Yamamoto and the Imperial Navy",
  "year": 1979,
  "publisher": "Kodansha International, Tokyo (trans. John Bester; first published in Japanese as 『山本五十六』, Shinchōsha, 1969)",
  "isbn": "978-0-87011-512-7",
  "notes": "The standard Japanese life of Yamamoto in English translation, written with access to his letters and to men who served with him. Sympathetic — the title is its thesis — and to be balanced against Toll and Parshall & Tully on the operational judgements."
}
