{
  "id": "source:belgian-grey-book-1914",
  "kind": "official-history",
  "tier": "primary",
  "author": "Ministère des Affaires étrangères de Belgique",
  "title": "Correspondance diplomatique relative à la guerre de 1914 (24 juillet – 29 août): the Belgian Grey Book",
  "year": 1914,
  "publisher": "Brussels; English translation in Collected Diplomatic Documents relating to the Outbreak of the European War (HMSO, London, 1915)",
  "url": "https://wwi.lib.byu.edu/index.php/The_Belgian_Grey_Book",
  "notes": "The Belgian government's published diplomatic file: No. 20 the German note of 2 August (German text and translation), No. 22 the Belgian reply of 3 August, No. 71 the memorandum on the delivery. A belligerent's publication, selected for effect on neutral opinion; the texts themselves are authentic. The BYU transcription carries OCR slips, corrected silently."
}
