{
  "id": "source:beesly-1982",
  "kind": "book",
  "tier": "study",
  "author": "Beesly, Patrick",
  "title": "Room 40: British Naval Intelligence 1914–1918",
  "year": 1982,
  "publisher": "Hamish Hamilton, London",
  "notes": "The Admiralty's signals-intelligence section from the 1914 codebook captures to the Zimmermann telegram; the forward link from 1914 wireless."
}
