{
  "id": "source:edmonds-1947",
  "kind": "official-history",
  "tier": "official-history",
  "author": "Edmonds, J. E.",
  "title": "Military Operations: France and Belgium, 1918, Volume IV: 8th August – 26th September: The Franco-British Offensive",
  "year": 1947,
  "publisher": "HMSO, London (History of the Great War based on Official Documents)",
  "url": "https://archive.org/details/mil-ops-fr-belg-1918-v-4",
  "notes": "Amiens on 8 August 1918 and the advance to the Hindenburg Line. The official account of the day the tech rail describes from source:haig-despatches-1919 — the commander's own despatches, advocacy from end to end — and from source:1914-1918-online-hundred-days, which is where the 'up to eight miles' comes from. Both are the wrong rung for a frontage and a depth. Nothing cites this volume yet."
}
