{
  "id": "source:ungern-sternberg-1996",
  "kind": "book",
  "tier": "study",
  "author": "Ungern-Sternberg, Jürgen von; Ungern-Sternberg, Wolfgang von",
  "title": "Der Aufruf 'An die Kulturwelt!': Das Manifest der 93 und die Anfänge der Kriegspropaganda im Ersten Weltkrieg",
  "year": 1996,
  "publisher": "Franz Steiner, Stuttgart",
  "notes": "Text, signatories, genesis and aftermath of the Manifesto of the 93."
}
