{
  "id": "source:kakehashi-2007",
  "kind": "book",
  "tier": "study",
  "author": "Kakehashi, Kumiko",
  "title": "So Sad to Fall in Battle: An Account of War Based on General Tadamichi Kuribayashi's Letters from Iwo Jima",
  "year": 2007,
  "publisher": "Presidio Press, New York (trans. Giles Murray; first published in Japanese, 2005)",
  "isbn": "978-0-89141-917-4",
  "notes": "Built on Kuribayashi's letters home, which it prints at length. Filed as a study rather than as primary because the letters reach the reader through the author's selection and argument; it is the only substantial English window onto the Iwo Jima garrison from the inside."
}
