{
  "id": "source:erisman-2008",
  "kind": "article",
  "tier": "study",
  "author": "Erisman, Jan Willem; Sutton, Mark A.; Galloway, James; Klimont, Zbigniew; Winiwarter, Wilfried",
  "title": "How a century of ammonia synthesis changed the world",
  "year": 2008,
  "publisher": "Nature Geoscience 1(10), 636–639",
  "url": "https://www.nature.com/articles/ngeo325",
  "notes": "The centenary assessment of the Haber–Bosch process, by nitrogen-cycle scientists rather than historians. Cited for the patent date — Haber filed on 13 October 1908 on the 'synthesis of ammonia from its elements' — and for its own summary that a hundred years on 'we live in a world transformed by and highly dependent upon Haber–Bosch nitrogen'. The paper's often-quoted estimate of the share of world population fed by synthetic nitrogen is behind the paywall and is deliberately not quoted here."
}
