{
  "id": "source:nobel-chemistry-1918",
  "kind": "web",
  "tier": "reference",
  "author": "The Nobel Foundation",
  "title": "The Nobel Prize in Chemistry 1918 — Fritz Haber",
  "year": 1918,
  "publisher": "NobelPrize.org, Stockholm",
  "url": "https://www.nobelprize.org/prizes/chemistry/1918/summary/",
  "notes": "The awarding body's own record. Cited only for the prize itself: the Chemistry prize for 1918 to Fritz Haber 'for the synthesis of ammonia from its elements', reserved and awarded in 1919, with the Nobel lecture delivered in June 1920. Reference data, in the same register as the biographical dates rule in docs/sources.md — not a source for anything about the gas programme."
}
