{
  "id": "source:hastings-2013",
  "kind": "book",
  "tier": "general",
  "author": "Hastings, Max",
  "title": "Catastrophe: Europe Goes to War 1914",
  "year": 2013,
  "publisher": "William Collins, London",
  "notes": "1914 from the July Crisis to the trench line; good on the human scale and the Belgian and Serbian fronts."
}
